Topic,Words,Frequency,Timestamp
71,"god, love, thee, salvation, christ",1.3778659611992945e-05,2016.0
77,"graziano, dale, sentence, rabbi, jersey",6.889329805996472e-06,2016.0
79,"japan, abe, tokyo, bill, cannataci",4.1335978835978834e-05,2016.0
83,"alebbini, dayton, isi, glassman, laith",6.889329805996472e-05,2016.0
84,"ashine, ethiopia, film, agriculture, donkey",6.889329805996472e-06,2016.0
85,"malaysia, netherlands, russia, dutch, ukraine",6.889329805996472e-06,2016.0
86,"georgia, cowsert, bill, ninowy, atlanta",2.0667989417989417e-05,2016.0
91,"forest, biofuel, mandate, carbon, oil",6.889329805996472e-06,2016.0
92,"mgm, company, victim, vega, liability",7.57826278659612e-05,2016.0
94,"patterson, wright, air, force, mcmurry",6.889329805996472e-06,2016.0
97,"pipeline, energy, greenpeace, transfer, dakota",1.3778659611992945e-05,2016.0
-1,"trump, said, terrorism, mr, america",0.004337585110627727,2018.0
0,"israel, palestinian, hama, uliel, syria",0.00018019641409135957,2018.0
1,"shoot, white, trump, violence, muslim",0.0008301906220637637,2018.0
2,"surveillance, bill, patriot, act, wolf",0.0002059387589615538,2018.0
3,"pakistan, india, indian, modi, kashmir",0.000984644691284929,2018.0
4,"trial, judge, court, prison, hassoun",0.0002509878624843937,2018.0
5,"al, qaeda, masri, libya, iran",0.0001029693794807769,2018.0
6,"insurance, risk, business, insurer, coverage",9.653379326322834e-05,2018.0
7,"hitler, bush, iraq, war, germany",1.930675865264567e-05,2018.0
8,"london, police, britain, stabbing, attack",0.00030247255222478215,2018.0
9,"france, paris, macron, attack, hebdo",0.0004118775179231076,2018.0
10,"obama, mr, turley, trump, white",7.722703461058268e-05,2018.0
11,"film, character, movie, story, stapleton",0.00021880993139665092,2018.0
12,"iran, sanction, bolton, trump, tanker",0.0002638590349194908,2018.0
13,"sudan, nigeria, africa, haram, boko",0.000855932966933958,2018.0
14,"alani, airport, airline, aviation, plane",5.792027595793701e-05,2018.0
15,"russia, putin, prokopyeva, kremlin, flynn",9.009820704567979e-05,2018.0
16,"benmoussa, ohio, frederick, milton, fire",1.930675865264567e-05,2018.0
17,"saudi, arabia, kingdom, hathloul, qatar",0.00017376082787381103,2018.0
18,"student, school, university, class, international",8.366262082813124e-05,2018.0
19,"morale, arce, bolivia, evo, peru",1.2871172435097113e-05,2018.0
20,"trump, republican, garbarino, voter, beach",7.079144839303412e-05,2018.0
21,"turkey, istanbul, altan, armenia, journalist",5.792027595793701e-05,2018.0
22,"nypd, cuomo, nashville, york, new",5.792027595793701e-05,2018.0
23,"indonesia, duterte, philippines, jakarta, philippine",0.00011584055191587402,2018.0
24,"germany, franco, right, europe, far",8.366262082813124e-05,2018.0
25,"mckee, ireland, ira, northern, lyra",2.5742344870194226e-05,2018.0
26,"financial, bank, launder, market, money",7.722703461058268e-05,2018.0
27,"disease, health, ricin, bio, spacewalk",2.5742344870194226e-05,2018.0
28,"nuclear, reactor, hap, climate, belgium",2.5742344870194226e-05,2018.0
29,"egypt, cairo, pompeo, brotherhood, sisi",2.5742344870194226e-05,2018.0
30,"frazee, batavia, teen, charge, chicago",0.00012227613813342258,2018.0
31,"spain, rubalcaba, basque, eta, aramburu",1.930675865264567e-05,2018.0
32,"canada, callimachi, times, story, ms",9.009820704567979e-05,2018.0
33,"baghdadi, iraq, al, baghdad, isi",9.653379326322834e-05,2018.0
34,"refugee, immigrate, immigrant, trump, country",7.079144839303412e-05,2018.0
35,"medal, veteran, service, army, norwalk",0.00010940496569832546,2018.0
36,"cuba, havana, castro, list, biden",1.930675865264567e-05,2018.0
37,"somalia, shabab, kenya, nalayeh, danab",3.861351730529134e-05,2018.0
38,"luxembourg, iran, immune, victim, court",2.5742344870194226e-05,2018.0
39,"tsarnaev, boston, marathon, tamerlan, brother",1.2871172435097113e-05,2018.0
41,"kong, china, hong, xinjiang, beije",0.00019950317274400526,2018.0
42,"un, neil, leicester, boxer, annan",1.2871172435097113e-05,2018.0
43,"ocoee, coast, kurtdere, guard, tampa",1.930675865264567e-05,2018.0
44,"tunisia, algeria, niqab, tunis, morocco",3.217793108774278e-05,2018.0
45,"zealand, australia, tarrant, christchurch, new",0.00017376082787381103,2018.0
47,"korea, north, botswana, elephant, warmbier",6.4355862175485565e-06,2018.0
50,"utrecht, tani, norway, tram, netherlands",5.792027595793701e-05,2018.0
51,"bowdoinham, donkey, sculpture, turgeon, maine",1.2871172435097113e-05,2018.0
52,"maduro, venezuela, colombia, drug, farc",1.930675865264567e-05,2018.0
53,"francis, pope, pandemic, facemask, vatican",1.930675865264567e-05,2018.0
55,"mexico, cartel, border, drug, deme",0.00012227613813342258,2018.0
57,"pensacola, saudi, shoot, naval, alshamrani",0.0002767302073545879,2018.0
60,"suljovic, sulojovic, utah, isi, advice",6.4355862175485565e-06,2018.0
61,"frese, leak, journalist, classified, kube",6.4355862175485565e-06,2018.0
62,"nato, alliance, macron, trump, europe",5.792027595793701e-05,2018.0
65,"whitmer, michigan, kidnap, governor, plot",0.00022524551761419947,2018.0
66,"lanka, sri, tamil, nandakumar, sinhalese",5.792027595793701e-05,2018.0
67,"salt, lake, borderline, utah, protest",1.930675865264567e-05,2018.0
68,"sesame, children, muppet, program, street",6.4355862175485565e-06,2018.0
69,"argentina, hezbollah, aires, buenos, clan",1.2871172435097113e-05,2018.0
70,"rittenhouse, webb, temple, sikh, wisconsin",1.2871172435097113e-05,2018.0
71,"god, francis, fraternity, name, divine",6.4355862175485565e-06,2018.0
75,"egypt, cairo, flight, aviation, airport",6.4355862175485565e-06,2018.0
76,"garcia, woodfield, javier, mall, suv",0.0001351473105685197,2018.0
77,"jersey, kosher, anderson, grew, city",6.435586217548556e-05,2018.0
78,"china, philippines, facebook, russia, network",6.4355862175485565e-06,2018.0
79,"japan, statue, aichi, expression, exhibit",1.2871172435097113e-05,2018.0
80,"charlie, hebdo, cartoon, magazine, france",3.217793108774278e-05,2018.0
83,"alebbini, dayton, anderson, sentence, isi",4.504910352283989e-05,2018.0
84,"ethiopia, wine, lissu, opposition, uganda",2.5742344870194226e-05,2018.0
86,"mcneill, georgia, brunswick, county, uac",1.2871172435097113e-05,2018.0
88,"klinghoffer, salamon, opera, hijack, leon",1.2871172435097113e-05,2018.0
94,"lecake, air, nasic, springfield, fitzgerald",6.4355862175485565e-06,2018.0
96,"rwanda, rusesabagina, kagame, kigali, genocide",7.079144839303412e-05,2018.0
97,"oil, pipeline, crude, train, derail",2.5742344870194226e-05,2018.0
98,"vienna, austria, nehammer, attack, shoot",3.861351730529134e-05,2018.0
